{
  "$schema": "http://json-schema.org/draft-07/schema#",
  "title": "EquityReturnsModelExtractor",
  "type": "object",
  "required": [
    "model_name",
    "variables",
    "steps_summary",
    "steps_detailed",
    "mermaid_diagram"
  ],
  "properties": {
    "model_name": {
      "type": "string",
      "description": "Exact model name or label used in the report for the U.S. equity return forecast approach."
    },
    "notes_model": {
      "type": "string",
      "description": "Optional extremely short list of key words summarizing the approach."
    },
    "steps_summary": {
      "type": "string",
      "description": "Concise summary of the end-to-end U.S. equity forecast approach."
    },
    "steps_detailed": {
      "type": "string",
      "description": "More detailed summary of the end-to-end U.S. equity forecast approach that explicitly includes all stated assumptions, constraints, and conditions relevant to the U.S. equity return forecast."
    },
    "variables": {
      "type": "array",
      "description": "Flat list of variables, inputs, ensure these are the primary variable and they are used by the model for U.S. equity return forecast.",
      "items": { "type": "string" }
    },
    "variables_important": {
      "type": "array",
      "description": "Optional list of explicitly important factors mentioned in the report for this approach.",
      "items": { "type": "string" }
    },
    "mermaid_diagram": {
      "type": "string",
      "description": "Mermaid flowchart showing how initial variables feed intermediary steps or checks and lead to the final U.S. equity return output."
    },
    "sub_models": {
      "type": "array",
      "description": "Optional list of named sub-models or component models mentioned for this extraction target.",
      "items": { "type": "string" }
    },
    "assumptions": {
      "type": "array",
      "description": "List of assumptions made by the model: variable values, relationships between variables, macroeconomic climate, and other stated or implied constraints. Implied assumptions end with '(implied)'.",
      "items": { "type": "string" }
    }
  },
  "additionalProperties": false
}
